"Date","Record Number","Record Type","Application Name","Status","Description",
"09/02/2020","CE-0512019","Complaint","Building-Unpermitted Work","New","Online - SMR""Violation of strong drainage compliance. Her (south west surface water draining from a rain water downspout directed into the ground. The property is sand and can be negatively affected with downspout water draining into the sand/ground.""",
"09/01/2020","CE-0512018","Complaint","Zoning-Miscellaneous","New","GID - 03062169 - SMR""Planters blocking the sidewalk""",
"09/01/2020","CE-0512017","Complaint","Building-Unpermitted Work","New","GID 03063199-RKL-Construction site unable to provide permit, which I understand is expired. Foreman claims City gave them permission to cut down trees.",
"09/01/2020","CE-0512016","Complaint","Building-Underground Electrical","New","Online - SMR""UUP Project 1YElectrical service riser needs to be secured to the building""",
"09/01/2020","CE-0512015","Complaint","Noise-Barking Dogs","Closed -Alternative Compliance","GID - 03059864 - SMR""Dog barking incessantly during early morning hours""",
"09/01/2020","CE-0512014","Complaint","Zoning-Sidewalk Cafe","New","GID - 03059217 - SMR""Pb shoreclub outside patio is obstructing stop sign, hazard to pedestrian traffic""",
"09/01/2020","CE-0512013","Complaint","Building-Unpermitted Work","New","Online-RKL-4 Houses on a single family dwelling",
"09/01/2020","CE-0512012","Complaint","Building-Unpermitted Work","Active Investigation","Online - SMR""has broken up sidewalks to park their vehicles on City sidewalks and block the right away of the public, this is not prohibited. We are asking you to come out and reverse whatever you permitted. This house has never had a driveway, parking has been an issue in our community and breaking sidewalks makes it worse.""",
"09/01/2020","CE-0512011","Complaint","Building-Unpermitted Work","Active Investigation","Online - SMR"":They try to break the sidewalks for a drive-way and its getting out of control!! Please stop allowing owners and tenants to break city sidewalks for the purpose of creating a driveway, as it is our neighborhood is over populated with too many apartments and parking is difficult to find.",
"09/01/2020","CE-0512010","Complaint","Building-Miscellaneous","New","Online-RKL-.  It appears that the garage door, when open, is in the way of traffic. The garage itself is at an odd angle. It was in the small alley north of Gravilla Street.The address is 234 Gravilla St. La Jolla CA 92037 (garage door in the alley).I wanted to see if this is not to code or not.  I took pictures, and it does look like the garage door sticks out into the alley. That being said - he gave me a quote to fix for over $7000 and I don't think it is my fault, based on how far the door goes into the alley when open.",
"09/01/2020","CE-0512009","Complaint","Building-Unpermitted Work","New","Online - SMR""Non permitted roof replacement, addition to the house, water heater (external), possibly more. Please add to the case that there is interior work also being done (today they are jackhammering inside).""",
"09/01/2020","CE-0512008","Complaint","Zoning-Fence Violation","New","Online - SMR""Construction of an overheight wall in street setback and possible in public right of way.I do not have the name of the property owner.  Note this building is near an elementary school and may create an unsafe condition as a lot of parents park in this area.""",
"09/01/2020","CE-0512007","Complaint","Building-Miscellaneous","New","Online-RKL-Apartment is not up to code.  The two bedrooms do not minimum habitable requirements.  Bedroom escape window does not ""meetrequirements: minimum clear opening of 20"" wide, 24"" high, and 5.7 sq. ft., sill height not more than 44"" above the finished floor, strictly enforced.""Each bedroom is not provided heating facilities.",
"09/01/2020","CE-0512006","Complaint","Noise-Barking Dogs","New","Online - SMR""They have one possibly 2 dogs that bark day and night...  From the looks of it they have them tied up with no food and water or shelter. The adults at this house is never home.""",
"09/01/2020","CE-0512005","Complaint","Noise-Other Offensive Noise","New","Online - SMR""ROOSTERS IN YARD WAKE US UP EVERY MORNING 6AM""",
"08/31/2020","CE-0512004","Complaint","Zoning-Fence Violation","New","GID - 03059285 - SMR""Front yard fence greater than 36"" tall. Code violation.""",
"08/31/2020","CE-0512003","Complaint","Zoning-Abandoned Properties","New","Email Referral-RKL-vacant lot with nuisance conditions",
"08/31/2020","CE-0512002","Complaint","Building-Mold","New","Online - MD3 ""There has been a chronic issue with water leaks on the apartment on top, this has led to water damage on several occasions. There is water damage on the inside and outside of the apartment.  The issue has always been partially fixed. Due to it being an ongoing issue we have mold and the paint is peeling on various parts of the ceiling and also leads to the smell of humidity. We have reported this issue to the landlord but he did not properly repair the issue. They came and scraped and repainted the walls but the new paint continues to peel off and fall around the apartment. We have contacted the landlord about the issue but he refuses to make any more repairs. We have continued to pay our rent in time but he will not repair the problem. Talking to the neighbors I have found out that a few of them also have the same issues with water damage but are not comfortable asking for repairs for fear of getting their rent raised or of being asked to move out of their apartments.""",
"08/31/2020","CE-0512001","Complaint",,"New","Online - SMR""Dog barking several times a day, every day, and most days after condo quiet hours 10 pm.""",
"08/31/2020","CE-0512000","Complaint","Zoning-Miscellaneous","Active Investigation","Online - SMR""The neighbor above use has cleared all brush and trees from the lower portion of the property and on a City of san diego Easement. We are down hill neighbors that have live in this area since 1976 are very concerned about the winter rains and Mud flow down to our homes onto our private driveway that serves 6 homes. Also they are building a fence with No Permit on City Water and sewer easement . We the neighbors living below are very concerned of No proper drainage being installed Now that there is no foliage to restrict water flow coming down hill. We must try to stop work as soon as possible .""",
"08/31/2020","CE-0511999","Complaint","Zoning-Parking in Front Yard","Closed -Alternative Compliance","Online - MD3 ""parking cockeyed in driveway, blocking sidewalk""",
"08/31/2020","CE-0511998","Complaint","Zoning-Parking in Front Yard","Closed -Alternative Compliance","Online - MD3 ""parking illegally off driveway""",
"08/31/2020","CE-0511997","Complaint","Zoning-Abandoned Properties","Active Investigation","GID - 03052712 - SMR""Abandoned burned down house""",
"08/31/2020","CE-0511996","Complaint","Building-Unpermitted Work","New","Online - SMR""We have observed contractor trucks in driveway and on street, saws in driveway, and general construction noises (hammers/saws/etc) for about a week.  I just ran the address through OpenDSD and confirmed there are no active permits that would explain the activity.""",
"08/31/2020","CE-0511995","Complaint","Zoning-Miscellaneous","New","Online - MD3 ""We had a huge mudslide during the rain in April/May and were looking for someone to build a retaining wall to stabilize mud patch.The contractor told us that other neighbors built right up to our drainage swale and asked if they had an easement for that. That likely contributes to our huge mud slide. Please look into it for us. Thank you!""",
"08/31/2020","CE-0511994","Complaint","Zoning-Fence Violation","New","Online - SMR""New fence is too high. They used slats to try to get around the rules but the slats cover the view into the yard 95%.""",
"08/31/2020","CE-0511993","Complaint","Zoning-Miscellaneous","New","Online - MD3 ""Numerous LOUD power tools.  Son recently moved home and brought a garage full of power tools, a large air compressor and an old car to restore. He works on this car along with others most every day with all kind of pneumatic tools, grinders, sanders, etc.  Sometimes it goes on over4-6 hours. XXXXXX """,
"08/31/2020","CE-0511992","Complaint","Zoning-Parking in Front Yard","Closed -Alternative Compliance","Online - SMR""parking parallel in driveway""",
"08/31/2020","CE-0511991","Complaint","Zoning-Parking in Front Yard","Closed -Alternative Compliance","Online - SMR""parking on lawn""",
"08/31/2020","CE-0511990","Complaint","Zoning-Storage/Hoarding","Active Investigation","Online - SMR""illegal storage on front yard - couch and table""",
"08/31/2020","CE-0511989","Complaint","Zoning-Storage/Hoarding","New","Online - SMR""there is much “stuff” in the front and side of the house accumulated for several years causing an unsafe and unhealthy condition, including a fire risk to the whole block which is surrounded by overgrown brush canyons""",
"08/31/2020","CE-0511988","Complaint","Zoning-Sidewalk Cafe","New","Online - MD3 ""Flicks bar is having very loud music outdoors everyday all day until eleven pm, or midnight . this bar do not have kitchen inside but they deliver tacos from a restaurant in the neighborhood. With the loud base outdoors makes it impossible for me to stay home. I am loosing sleep, and failing my classes because they are playing music until midnight in the parking lot making it like a night club style which is facing my room directly. I am asking for this issue to be investigated and possibly for the outdoor base to be removed.""",
"08/31/2020","CE-0511987","Complaint","Zoning-Unpermitted Business (Residential Zone)","New","Online - MD3 ""Unsure if owner or tenants lives in house.Appears to be a ‘chop shop’. Lots of traffic, lots of cars, orange traffic cones in street affecting traffic. Canapys set up to accommodate activity.""",
"08/31/2020","CE-0511986","Complaint","Building-Infestation","Active Investigation","Online - MD3 ""Bedbug infestation, leasing office claimed we brought them in in July, when we found them and reported. We found out this week our neighbor also got them in June, and the property managers are not disclosing other apartments in the same building have them, and  are blaming each tenet and we are lying for pest control. The property managers are not spraying adjoining apartments so the bugs are coming back. It’s a safety issue and we just want the bugs gone.""",
"08/31/2020","CE-0511985","Complaint","Zoning-Unpermitted Business (Residential Zone)","New","Online - SMR""Building is being used as an unpermited intermediate care facility.""",
"08/31/2020","CE-0511984","Complaint","Building-Infestation","Active Investigation","Online - MD3 ""I've had roaches infested in my apartment for over one year""",
"08/31/2020","CE-0511983","Complaint","Building-Miscellaneous","New","Online - SMR""CITED FOR RACKS ABOVE 5’ 9” BY SDFD""",
"08/28/2020","CE-0511982","Complaint","Building-Infestation","New","Online-RKL- Cockroaches",
"08/28/2020","CE-0511981","Complaint","Zoning-Storage/Hoarding","Active Investigation","Phone-RKL-Excessive Storage and Hoarding, rats beginning to show up.",
"08/28/2020","CE-0511980","Complaint","Building-Unpermitted Work","Active Investigation","Online-RKL-room addition, no permits, not up to code, health hazards building defect in foundation, never remediated continue to rent out knowing its not up to code and knowing that it presents a health and safety issue",
"08/28/2020","CE-0511979","Complaint","Building-Unpermitted Work","New","Online-RKL-Illegal living room extension without a permit.",
"08/28/2020","CE-0511978","Complaint","Zoning-Sidewalk Cafe","New","Email Referral-RKL-Illegal Sidewalk café. (Deck and sun shade)",
"08/28/2020","CE-0511977","Complaint","Building-Unpermitted Work","New","Online - SMR""Property has multiple unpermitted additions. Basement is being used as a studio that is rented out.""",
