"Date","Record Number","Record Type","Application Name","Status","Description",
"09/04/2020","CE-0512075","Complaint","Zoning-Lighting","New","Mailed In-RKL-Lights hung in back yard affecting neighboring property.",
"09/04/2020","CE-0512074","Complaint","Building-Unpermitted Work","New","Online-RKL-Neighbor cut the curb and made his own driveway and them tried to pain the street red to stop people from parking in front of his new driveway. It doesn't seem to be permitted.",
"09/04/2020","CE-0512073","Complaint","Zoning-Sidewalk Cafe","New","Online-RKL-Outdoor dining area surpassing allowed space on public roadway, hindering public parking",
"09/04/2020","CE-0512072","Complaint","Zoning-Discretionary Permit Violations","New","Online - SMR""PTS 31491, Sprint London American General, expired on 8/2/14. Project consists of two sectors of one antenna each and roof mounted equipment.  Sprint may still be the tenant, but it is not on their inventory.It is on Crown Castle's inventory.""",
"09/04/2020","CE-0512071","Complaint","Zoning-Discretionary Permit Violations","New","Online-RKL-Wireless Issue-PTS 202558 Sprint Fresh & Easy, expired on 6/11/20.  No new application submitted. T-Mobile is also at this site.",
"09/04/2020","CE-0512070","Complaint","Building-Unpermitted Work","New","Online-RKL-2 subterranean basement spaces in the rear of the building being rented out, not up to code, no clearly marked unit numbers, etc to adults and multiple children in each space",
"09/04/2020","CE-0512069","Complaint","Noise-Nuisance Referral","New","Online-RKL-The next door neighbors are consistently working after 7 PM. They initially began working outside of designated hours beginning on Monday, May 25th, and most recently, on September 2nd, 2020.",
"09/04/2020","CE-0512068","Complaint","Zoning-Newsracks","New","GID - 0.065525 - SMR""Newsrack got vandalized and is now missing the glass door""",
"09/03/2020","CE-0512067","Complaint","Zoning-Miscellaneous","New","GID 03065614_RKL-Encroachment into PROW-Rockford and Montezuma on Rockford porta potty blocking ? access. They say they have a right to put porta potty on sidewalk to block wheel chair access please fix so i can get home",
"09/03/2020","CE-0512066","Complaint","Building-Unpermitted Work","New","Online-RKL- The tenant Josie just built a patio right up against my fence line. No permit and now I can’t fix the fence. I will get run off and she’s intention is to enclose it to a room just like she did with the front patio. I believe the my are also living out of a Rv her brother in the back alley of the house And also said that her intent was to take it down she does all of their without the absentee owner knowing what’s going on. Also mentioned that there is cars that rotate outside every three days don’t know what that’s about if if her brother is involved in something else",
"09/03/2020","CE-0512065","Complaint","Zoning-Sidewalk Cafe","New","Email Referral-RKL-815-823 05th Av-restaurants operating in the PROW-platform without a permit",
"09/03/2020","CE-0512064","Complaint","Zoning-Sidewalk Cafe","New","Email Referral-RKL-restaurants operating in the PROW-platform without a permit",
"09/03/2020","CE-0512063","Complaint","Zoning-Sidewalk Cafe","New","Email Referral-RKL-restaurants operating in the PROW-platform without a permit",
"09/03/2020","CE-0512062","Complaint","Zoning-Sidewalk Cafe","New","Online-RKL-restaurants operating in the PROW-platform without a permit",
"09/03/2020","CE-0512061","Complaint","Noise-Other Offensive Noise","Closed -Alternative Compliance","Online - SMR""Resident has multiple chickens and a Rooster in the back yard.  The back yard is on top of a hill and over looks the lower streets (Revillo drive, 92115)  in the canyon.  The resident's roosters crows several times an hour, everyday starting at 4:00 am until in to the night.  This has been going on since June 2020. The county was notified and referred me to this website based on property jurisdiction.""",
"09/03/2020","CE-0512060","Complaint","Building-Mold","New","Online-RKL-We currently are leasing 4775 Lamont St in Pacific Beach and move out on Sep 7th. There are a couple of items we'd like to report on this home before we leave. The first, and most concerning issue, is the presence of mold. In the showers, near the front door, under the staircase, and in the downstairs bedroom. My roommate has multiple handbags and shoes ruined because they have been found covered in the mold during our packing process. Under the staircase, there is a strong odor of mildew and we have found damp items underneath that we originally had placed in there for storage.  We are now questioning if the presence of mold has had any effect on our personal health as some of us have been experiencing symptoms of mold exposure.The second issue is the staircase. The stairs are relatively small and uneven in size (I'm unsure the code standards on stairs) but they are certainly not up to code. This past year by roommate fell on the staircase and fractured her tailbone (which she needed to be taken to the hospital for) and had to endure the effects of.The third and final issue is the sewage for all of the units in our area has come up in the downstairs shower multiple times now and gets drained through our backyard in a hole. We were unaware upon signing the lease that the sewage hole was in our backyard and there was any potential to have backlogged items come up next to our grass.We move out in a couple of days so there's not much we'd like to change going forward. We'd like to know if and what actions can be taken against the mold and if we need to be concerned about our health/personal items. Second, we'd like to make the city aware that this home (built-in 1901 may I add) could potentially get turned around and leased out to a new group who is going to be completely unaware of these issues. If someone is unavailable to come look at the property before we move out, we'd strongly encourage someone to follow up with our landlord to see if he makes any of the necessary changes. Please feel free to contact us with any questions, again we are looking for guidance and any recommendations the city has at this point.",
"09/03/2020","CE-0512059","Complaint","Building-Unpermitted Work","New","Online-RKL-The awning built on property 3266 Island Ave, encroaches into my property, 3262 Island Ave San Diego, CA 92102. The awning extends over my wood fence and is actively contributing to the premature deterioration of the wood.",
"09/03/2020","CE-0512058","Complaint","Zoning-Sidewalk Cafe","New","Email - SMR - NQW""restaurants operating in the PROW-platform without a permit. """,
"09/03/2020","CE-0512057","Complaint","Zoning-Sidewalk Cafe","New","Email - SMR * NQW[Violation address: 926 05th Ave & 936 05th Ave]""restaurants operating in the PROW-platform without a permit. """,
"09/03/2020","CE-0512056","Complaint","Building-Unpermitted Work","Active Investigation","GID 03065013-RKL-At the new Spirit Halloween store. Construction crew working with loud equipment at 6:30 in the morning.",
"09/03/2020","CE-0512055","Complaint","Building-Inadequate Barriers for Pools/Spas","Active Investigation","Online - SMR""1. Extensive renovation/ remodel apparently without a permit!  House Walls are removed inside except for framing, driveway is removed, etc.2. Urgent safety issue: front fence is removed and replaced only by caution tape, leaving easy access from street to  an open swimming pool 30 feet away, surrounded only by some street cones and caution tape. Pool was finally drained last week, but remains a hazard to fall into.  Children in neighborhood have easy access on foot or on a bicycle.,""",
"09/03/2020","CE-0512054","Complaint","Zoning-Miscellaneous","New","GID 03064221-RKL-Obstruction on sidewalk that is extremely dangerous to elderly pedestrians since elderly pedestrians walking on the sidewalk must now move to the street to get around this unsafe obstruction. Obstruction placed by resident of 8885 Ragweed Court, San Diego, CA 92129. Perhaps this should be moved to the residents OWN property as not to obstruct the sidewalk for elderly pedestrians?",
"09/03/2020","CE-0512053","Complaint","Building-Unpermitted Work","New","GID - 3064826 - SMR""This is the unfinished employee parking lot for Family Health Center located at 5454 El Cajon Blvd. Its a mess and has been an eyesore in the neighborhood for at least 3 years. When it rains mud is everywhere. The City needs to make them finish it or shut it down""",
"09/03/2020","CE-0512052","Complaint","Building-Miscellaneous","New","Online-RKL-There is water damage in the bedroom and our bathroom door doesn’t close completely or gets stuck and is very difficult to open which is a concern for our small ones and is also a fire hazard. We have been living here for 13 years and since we have been here the apartment has not been painted and when we ask the owners to come and fix stuff around the apartment they don’t or say it on us to fix it. Our stove has been having problems for a long time and they have yet to replace or fix it, our kitchen is missing several handles and is almost falling apart. We are not the only ones who have problems, many of the tents have expressed that they don’t even bother complaining anymore since they don’t listen to us. But enough is enough.",
"09/03/2020","CE-0512051","Complaint","Building-Miscellaneous","New","GID - 03062123 - SMR""This is Greece drainage from the northeast corner of the Smart & Final building. A stench has been stinking up the whole block for several months now. I believe it's coming from this spot. I live in the apartment building next door and I'm concerned about toxic materials. The whole area the entire apartment complex when you go outside smells very very badly multiple times a week""",
"09/03/2020","CE-0512050","Complaint","Noise-Barking Dogs","New","Online-RKL-Constant NEW Dog Barking on a daily basis",
"09/03/2020","CE-0512049","Complaint","Zoning-Unpermitted Business (Residential Zone)","New","Online-RKL-New tenant moved in next door and is running a school or learning pod out of a small office.  The office is less than 300 sq feet, has no bathroom or sink to wash hands and they have 6 kids and two teachers in a very small claim space with no social distancing.  They claim they are doing therapy which is a crock of shit.  The same 6 kids attend group therapy M-F from 8-12.  This is totally unacceptable, in violation of county health orders.  In addition, they are claiming they are a therapy center to get around city guidelines for schools etc.",
"09/03/2020","CE-0512048","Complaint","Building-Unpermitted Work","New","Online-RKL-The owner-John DeBeck took out swimming pool without permit.  I don't know what he filled it with, but it is NOT safe land.When his garage in back was built, there was an area above garage built  as a library.  That library (?) has been a rental unit for many years.  The garage is full of rats.  The county has come out but he doesn't care.He is doing construction in the house currently .  I don't know what he is doing.",
"09/03/2020","CE-0512047","Complaint","Building-Unpermitted Work","New","Online - SMR""Tenants at Jewelry Exchange building  are sleeping overnight in office spaces.  I Witnessed Suite 706, and Suite 822 ( couches, clothing, personal items ) during the annual fire inspection.  BuildingManager is aware tenants using office spaces as living quarters.   There aresigns of un-permitted construction throughout the 8 story high rise.  (Electrical, Mechanical Hood Systems ).   Removal of a door ( Southeast cornerof building leading to parking lot ).  Please contact Deputy Fire Marshal Robert Marshall to coordinate a meeting with code enforcement.""",
"09/03/2020","CE-0512046","Complaint","Zoning-Miscellaneous","New","Online-RKL-Has landscaped “parkway” infront of his house to create a major hazard. Lots of large palms, bushes, And birds of paradise with a lot of filler in between. Impossible for pedestrians to see or be seen when crossing the street from this corner, and impossible to cross street from opposite direction and access sidewalk by crossing parkway. I was almost hit by a car today crossing here, and since this has occurred multiple times due to this landscaping, I am requesting something be done about it. These plants also prevent anybody parking infront of this parkway from getting out of their passenger side door due to placement of large plants. Owner has even taken to blocking portion of sidewalk that runs from curb, across parkway, to main sidewalk by training a palm to grow on top of it, blocking the sidewalk.   This needs addressed for obvious safety reasons. I am all for the beautification and upkeep of parkways, but in a manner that doesn’t block citizens from doing simple things like crossing the street safely or getting out of their vehicle. I was under the impression you needed a permit to develop parkways, and clearly no one would approve this. The intentions of the homeowner are clear. He has landscaped the parkway like this to deter people from parking in front of his house or crossing the street in front of his house, even going so far to cover up public sidewalks. Please address this.",
"09/03/2020","CE-0512045","Complaint","Zoning-Sidewalk Cafe","New","Phone Referral from AXC-Sidewalk Cafe",
"09/03/2020","CE-0512044","Complaint","Zoning-Sidewalk Cafe","New","Email Referral-RKL-Sidewalk Cafe",
"09/03/2020","CE-0512043","Complaint","Zoning-Sidewalk Cafe","New","Email Referral-RKL-Outdoor Deck",
"09/03/2020","CE-0512042","Complaint","Zoning-Sidewalk Cafe","New","Email Referral-RKL-operating restaurant in the PROW",
"09/02/2020","CE-0512041","Complaint","Building-Infestation","New","Online-RKL-Hotel room #239 had bed bugs during my stay Saturday, August, 22 2020.  I sustained 40+ bites and informed Hotel Management about the bugs (bringing them a couple and snapping some extra pictures for myself) Sunday August, 23.  I was told that a daytime manager that handles bed bugs(Brian?) would call me that day to refund my stay.  It is now 9/2/2020 and I have not heard from the property.  I dont think that they did anything and I am terrified that other guests are getting bit and being ignored.  PLEASE HELP!!!",
"09/02/2020","CE-0512040","Complaint","Building-Mold","New","Online-RKL-PTS only shows 4741, but violation is at 4745.  Mold in closet and on suitcase and other issues.",
"09/02/2020","CE-0512039","Complaint","Building-Miscellaneous","New","Online - SMR""This is a duplex. There is a porch on the front of the upstairs unit. The decking for the porch is sagging several feet toward the ground. Residents use the porch for seating. The potential for bodily harm, either to the residents or to passersby, is great.""",
"09/02/2020","CE-0512038","Complaint","Zoning-Unpermitted Business (Residential Zone)","New","Online - SMR""Working a RV trailer inches from our property line and making loud and sustained noises.  Parking in front of the driveway. Both obstructing our view when exiting our property to Crystal Drive. This creates a dangerous situation. They Working on the Trailer in the afternoon.""",
"09/02/2020","CE-0512037","Complaint","Building-Unpermitted Work","New","Online - SMR""To my knowledge, there has been multiple un-permitted buildings erected on this property, including a large ADU as well as other various construction projects to which I have not seen an inspector come signoff on.   There are at times more than 12 vehicles on the property and it isapparent there are approximately 15+ persons living on the property at various times.  This includes people living in an RV on the property which Ialso believe is a code violation.   The owners reside on premise but I do notknow their names.  They are running a janitorial business out of their house which regularly receives commercial vehicle deliveries to their location.This location is not zoned for multi-family housing.  Requesting the city perform a detailed and in-depth investigation into all and any code violations including but not limited to the following items:1) Structures built on site2) Other construction performed on site3) Vehicles parked/stored on site4) Number of persons residing on site5) Living in RVThank you.""",
"09/02/2020","CE-0512036","Complaint","Building-Infestation","Active Investigation","Online-RKL-Uninhabitable living conditions.  Excess amount of rats and roaches living in home, eating through electrical wires. Running about the property while trying to clear out. 3 neighboring complaints and concerns regarding the condition.  I have spoken to the owner Michael Jacobelly and told him it needed to be resolved. He called LLoyd Pest control but issue issevere and needs immediate remediation.   No clearance received from company.   Mobile home property owned by resident however they pay site rent to the park.",
"09/02/2020","CE-0512035","Complaint","Zoning-Storage/Hoarding","New","Online - SMR""This property has become a junk yard,scrap ,storage,hotel, We know this property it's a Vacant lot, People are living in this property with no services,people are stealing water from us, Trash it's all around the adjacent streets, Cars,motorhomes,are being dismantled, We're tired and contacted the city of chula vista they claim it belongs to the city of san diego.""",
"09/02/2020","CE-0512034","Complaint","Zoning-Abandoned Properties","New","Online-RKL-This property was purchased approximately in April or June.  It has remained abandoned and dirt and leaves are accumulating and the home looks deserted.  It starting to look like a fire hazard with all the accumulation.  My concern, will this become an attractive nuisance.",
"09/02/2020","CE-0512033","Complaint","Zoning-Storage/Hoarding","New","Online - SMR -EMB ""Excessive hoarding in all yards, homeless and transients living in motorhomes and vehicles on driveway and throughout the property. Egress issues in the home.""",
"09/02/2020","CE-0512032","Complaint","Building-Unpermitted Work","New","Online-RKL-Citizen complaint, call in. New owners converting lower level garages into dwelling units, constructing unpermitted retaining walls in front yard. No active permits or submittals.",
"09/02/2020","CE-0512031","Complaint","Noise-Barking Dogs","New","Online-RKL-One large dog and 2 small dogs bark constantly when owners are not home (which is a lot).",
"09/02/2020","CE-0512030","Complaint","Noise-Barking Dogs","Closed -Alternative Compliance","Online-RKL-Excessive barking.  I have visually confirmed two dogs in their backyard. At times, they continuously bark for 30 minutes straight throughout the day and night.  Small brown chihuahua and black shepherd.Most notably the barking occurs at 1:00 am and between 3:00 and 4:00 am.",
"09/02/2020","CE-0512029","Complaint","Building-Mold","New","Online-RKL-have not done any of the repairs since I moved in that I asked for and that was promised to me move-in day was March 5th 2019even after move-in date promise to fix everything once got some money in a few weeks which has not even been done yet only thing that has been replaced as the refrigerator my oven does not work I have no smoke detectors and carbon dioxide detector my kitchen sink is leaking and has fungus with mold my bathroom has a water leak in the bathroom ceiling I have a hot water heater that has stuff stocked away in it with carpet also have a lot of spiders as to get sprayed for bugs also ask for a trash can since everything else was included with utilities involved I am also getting help through a third-party federal funds through the father Joe's village program I have reported everything to case management they have not done anything to help the situation for me and my child I have no air in here I was told I could not get a heater when it was cold in the winter seasons I will be having to move soon and father Joe's will still be in my 3rd party payment and I do not want to move anywhere else if I am going to have to face the same issues that I'm facing here which is not fair I cannot even start school because of the things that I'm going through and I wanted to leave the property what's a Gunther my unit without permission not saying that to happen but it could be a possibility also the maintenance man that she said it was my maintenance man is now the owner who has never been in my unit to repair anything when I informed her to she wanted me to contact the repairman I mean maintenance man which is not my responsibility I think the code of command would be needs to contact her for any repairs and she contacts him and then contact me to let me know the time of entrance of the unit to fix all of the things that I am requesting to be fixed so I would like someone to come out here and help me on my behalf because I am not going to continue to live the way that I am living and my words are not being heard",
"09/02/2020","CE-0512028","Complaint","Building-Substandard Housing","New","Online - SMR""Bulges in my flooring all over my home and is it has been and is unsafe for my family and I to live here.its soft big bulges that smell and is spreading with black stuff around and under the tile.were getting sick in the apartment. No vendor has come to see or fix this.its been almost 3 months. This is no way to live""",
"09/02/2020","CE-0512027","Complaint","Zoning-Unpermitted Business (Non-Residential Zone)","New","Online - SMR""We have been dealing with an extremely loud new shop that opened up earlier this year at 4685 Hawley Blvd Unit B - just west of us outside both of our bedroom windows.It is an auto detailing shop, which you wouldn't think would be very loud, but they consistently have 70-90 decibel noises and, since it is so hot, we have had to open our windows this summer. We have avoided this the whole year, since the shop has started their business. They use smelly gas generators, power washers, electric wax & buffers (think a dentist drilling down your teeth for a root canal), and their means of communication is whistling, yelling, and sneezing extremely loud. They also have a porta potty right outside our window that stinks and it is baking in the sun now. They do not have a rest room for their employees and thats why they have the porta pottys. Is that even legal to not have a restroom in your office space? """,
"09/02/2020","CE-0512026","Complaint","Building-Mold","Active Investigation","Online-RKL-Water leakage has damaged greatly  my unit and there is a lot of mold growing in the unit. I am concerned because the owner is not taking care of it & it and can affect my unit. Please investigate.",
"09/02/2020","CE-0512025","Complaint","Zoning-Unpermitted Business (Residential Zone)","New","Online - SMR""Illegal restaurant within the residential neighborhood.The person does have a food handler lic but I don't no believe they applied for the appropriate permits from the City of SD""",
"09/02/2020","CE-0512024","Complaint","Zoning-Unpermitted Business (Residential Zone)","Active Investigation","Online-RKL-Unpermitted auto work in residential zone.  The noise coming from this property almost everyday is very loud and excessive. The owner  is converting a delivery  van  to a camper. He is installing a bed, sink, shower, toilet and counter top in it as far as we know from his conversations with passers bye. He is doing this in his driveway and he blocks the sidewalk .Walkers have to step into the street to pass. He has also worked  on it in the street. He does not work on it in his garage. A neighbor told him the other day that blocking the sidewalk is illegal but he continues. We cannot escape from his noise even with the windows and doors shut. We have to endure the loud noise of cutting and grinding of steel and wood, and an air wrench and hammering. He has damaged our quality of life .We have called the police several times and he still will not stop. This noise goes on from the time he is up until he goes to bed. Before working on this van he was noisily making items for sale from wood and steel in his driveway. The level and duration of this noise is stressful and unacceptable..We believe he is converting this van to sell as we have heard him in his driveway discuss the potential profit. Even though we are not near him we have to endure his loud voice when he stops everyone who walks by, to talk to them. We no longer have peace and enjoyment in our own home. The open metal box of the van, facing the street serves to amplify and direct the sound towards our house.",
"09/02/2020","CE-0512023","Complaint","Building-Miscellaneous","New","Online - SMR""There is also and extension cord run to power the pump. Using an extension cord in place of permanent wiring.""",
"09/02/2020","CE-0512022","Complaint","Noise-Barking Dogs","Closed -Alternative Compliance","Online-RKL-Even after several personal requests, the owner will not do anything to prevent his dog from barking. This goes on for 8 - 10 hours per day every day. The violation has been reported several times by several neighbors and nothing has been done, not even a response.",
"09/02/2020","CE-0512021","Complaint","Building-Substandard Housing","Active Investigation","Online - SMR""No hot water. (Please read full complaint)""",
"09/02/2020","CE-0512020","Complaint","Zoning-Lighting","Closed -Alternative Compliance","Online-RKL-Lighting Regulations Section 142.0740( c) (2),  and  (c)(5), since Covid started in March, a condo owner has been leaving on all night every night her second story, outdoor, unshielded balcony light that only shines outward on a horizontal plane into and illuminating my second story bedroom all night every night.",
